{
  "schema_version": "0.1.0",
  "systems": [
    {
      "id": "MainSystem",
      "name": "Main System",
      "components": ["scalar"],
      "connections": [],
      "public_inputs": [
        {
          "id": "value",
          "name": "Value",
          "component": "scalar",
          "node": "value",
          "medium": "signal",
          "value_type": "float",
          "unit": "",
          "required": true
        }
      ],
      "public_outputs": [
        {
          "id": "result",
          "name": "Result",
          "component": "scalar",
          "node": "result",
          "medium": "signal",
          "value_type": "float",
          "unit": ""
        }
      ]
    }
  ],
  "components": [
    {
      "id": "scalar",
      "name": "Scalar Component",
      "kind": "user_python",
      "category": "utility",
      "execution_mode": "step",
      "class": "components.scalar.ScalarComponent",
      "source": {
        "layout": "single_file_class",
        "step": "components/scalar.py"
      },
      "nodes": {
        "inputs": [
          {
            "id": "value",
            "name": "Value",
            "preset": "scalar_input",
            "direction": "inlet",
            "medium": "signal",
            "value_type": "float",
            "unit": "",
            "required": true
          }
        ],
        "outputs": [
          {
            "id": "result",
            "name": "Result",
            "preset": "scalar_output",
            "direction": "outlet",
            "medium": "signal",
            "value_type": "float",
            "unit": ""
          }
        ]
      },
      "parameters": {
        "gain": 2.0
      },
      "parameter_defs": {
        "gain": {
          "display_name": "Gain",
          "unit": "ratio",
          "default": 2.0,
          "current": 2.0,
          "bounds": {
            "min": 0.0,
            "max": 100.0
          },
          "role": "calibration_target",
          "group": "Model",
          "description": "Multiplier applied to the input value."
        }
      }
    }
  ],
  "connections": []
}
