{
  "schema_version": "0.1.0",
  "systems": [
    {
      "id": "MainSystem",
      "name": "Main System",
      "components": ["solver_boundary"],
      "connections": [],
      "public_inputs": [
        {
          "id": "target",
          "name": "Target",
          "component": "solver_boundary",
          "node": "target",
          "medium": "signal",
          "value_type": "float",
          "unit": "",
          "required": true
        },
        {
          "id": "initial",
          "name": "Initial Guess",
          "component": "solver_boundary",
          "node": "initial",
          "medium": "signal",
          "value_type": "float",
          "unit": "",
          "required": false,
          "default": 0.0
        }
      ],
      "public_outputs": [
        {
          "id": "solution",
          "name": "Solution",
          "component": "solver_boundary",
          "node": "solution",
          "medium": "signal",
          "value_type": "float",
          "unit": ""
        },
        {
          "id": "iterations",
          "name": "Iterations",
          "component": "solver_boundary",
          "node": "iterations",
          "medium": "signal",
          "value_type": "integer",
          "unit": "count"
        },
        {
          "id": "converged",
          "name": "Converged",
          "component": "solver_boundary",
          "node": "converged",
          "medium": "signal",
          "value_type": "boolean",
          "unit": ""
        }
      ]
    }
  ],
  "components": [
    {
      "id": "solver_boundary",
      "name": "Solver Boundary",
      "kind": "user_python",
      "category": "solver",
      "execution_mode": "step",
      "class": "components.solver_boundary.wrapper.SolverBoundaryComponent",
      "source": {
        "layout": "generated_wrapper",
        "metadata": "components/solver_boundary/component.json",
        "init": "components/solver_boundary/user_init.py",
        "step": "components/solver_boundary/user_step.py",
        "helpers": "components/solver_boundary/helpers.py",
        "wrapper": "components/solver_boundary/wrapper.py"
      },
      "nodes": {
        "inputs": [
          {
            "id": "target",
            "name": "Target",
            "preset": "scalar_input",
            "direction": "inlet",
            "medium": "signal",
            "value_type": "float",
            "unit": "",
            "required": true
          },
          {
            "id": "initial",
            "name": "Initial Guess",
            "preset": "scalar_input",
            "direction": "inlet",
            "medium": "signal",
            "value_type": "float",
            "unit": "",
            "required": false,
            "default": 0.0
          }
        ],
        "outputs": [
          {
            "id": "solution",
            "name": "Solution",
            "preset": "scalar_output",
            "direction": "outlet",
            "medium": "signal",
            "value_type": "float",
            "unit": ""
          },
          {
            "id": "iterations",
            "name": "Iterations",
            "preset": "scalar_output",
            "direction": "outlet",
            "medium": "signal",
            "value_type": "integer",
            "unit": "count"
          },
          {
            "id": "converged",
            "name": "Converged",
            "preset": "scalar_output",
            "direction": "outlet",
            "medium": "signal",
            "value_type": "boolean",
            "unit": ""
          }
        ]
      },
      "parameters": {
        "relaxation": 0.5,
        "max_iterations": 4,
        "tolerance": 0.0
      },
      "parameter_defs": {
        "relaxation": {
          "display_name": "Relaxation",
          "unit": "ratio",
          "default": 0.5,
          "current": 0.5,
          "bounds": {
            "min": 0.0,
            "max": 1.0
          },
          "role": "fixed",
          "group": "Solver",
          "description": "Fraction of the target residual applied each iteration."
        },
        "max_iterations": {
          "display_name": "Max Iterations",
          "unit": "count",
          "default": 4,
          "current": 4,
          "role": "fixed",
          "group": "Solver",
          "description": "Maximum internal iterations before returning the latest estimate."
        },
        "tolerance": {
          "display_name": "Tolerance",
          "unit": "",
          "default": 0.0,
          "current": 0.0,
          "role": "fixed",
          "group": "Solver",
          "description": "Convergence threshold for the change in solution."
        }
      },
      "state_defs": {
        "last_solution": {
          "display_name": "Last Solution",
          "unit": "",
          "initial": 0.0,
          "description": "Previous solver estimate used as a warm start."
        }
      },
      "solver_boundary": {
        "method": "fixed_point",
        "max_iterations": 4,
        "tolerance": 0.0,
        "description": "Feedback behavior is handled inside this component; the project graph remains acyclic."
      }
    }
  ],
  "connections": []
}
