{
  "schema_version": "0.1.0",
  "systems": [
    {
      "id": "MainSystem",
      "name": "Invalid Public Output Mapping",
      "components": ["gain"],
      "connections": [],
      "public_inputs": [
        {
          "id": "value",
          "name": "Input Value",
          "component": "gain",
          "node": "value",
          "medium": "signal",
          "value_type": "float",
          "required": true
        }
      ],
      "public_outputs": [
        {
          "id": "result",
          "name": "Result",
          "component": "gain",
          "node": "missing_result",
          "medium": "signal",
          "value_type": "float"
        }
      ]
    }
  ],
  "components": [
    {
      "id": "gain",
      "name": "Gain",
      "kind": "user_python",
      "class": "components.scalar.Gain",
      "nodes": {
        "inputs": [
          {
            "id": "value",
            "name": "Value",
            "direction": "inlet",
            "medium": "signal",
            "value_type": "float",
            "required": true
          }
        ],
        "outputs": [
          {
            "id": "result",
            "name": "Result",
            "direction": "outlet",
            "medium": "signal",
            "value_type": "float"
          }
        ]
      },
      "parameters": {}
    }
  ],
  "connections": []
}
